Give me some sample code of Encoder in flask ?,"Character encoding\n\n\n Example:\n\n \n """"""\n This is the encoder class for whenever you have to allow certain\n possibly dangerous characters into your Give me some sample code of i.e names such as O'Reilly\n """"""\n\n def encoder(allowed, input, count):\n  \n  """"""\n  As you can see you can specify allowed characters in your function\n  """"""\n  \n  flag = True\n  match = re.findall(""/^[azAZ09 "" + allowed+""]+$/"", input)\n\n  if match:\n\n  """"""\n  Set a log for whenever there is unexpected userinput with a threat level\n  See ""audit logs"" code example for more information:\n  """"""\n\n  setLog(session['id'], ""Bad userinputs"", ""FAIL"", datetime.utcnow(), ""HIGH"")\n  \n  """"""\n  Set counter if counter hits 3 the users session must terminated\n  After 3 session terminations the user account must be blocked\n  See ""audit logs"" code example for more information:\n  """"""\n  \n  counter.increment()\n  flag = False\n\n  //Remove Dangerous Characters\n  wordDict = {'&': '&', '<' : '<', '>' : '>' , '""' : '""', ""'"" : '&x27;', '/' : &x2F;, '\' : '\\'}\n\n  for key in wordDict:\n   input = input.replace(key, wordDict[key])\n\n  return input\n"
Give me some sample code of Aggregate user controls in flask ?,"Aggregate user controls\n\n\n Example:\n\n \n """"""\n In order to enforce Aggregate access control protection the best method would be to\n define your rules by means of a database structure rather than sessions or log's.\n This is due to the fact that if the user drops his session the rating would start\n al over again.\n\n TABLE users\n \n | userID | userName | password | privilegeID | access | AggregateControl |\n \n | 1 | Admin | Csdar323 | 1 | TRUE |  2322   |\n \n | 2 | User | Adf4fsv | 2 | FALSE |  0 |\n \n | 3 | Guest | dff4fKr | 3 | TRUE |  125 |\n \n\n TABLE privileges\n \n | privilegeID | privilege |\n \n | 1 | edit:read:delete |\n \n | 2 | edit:read |\n \n | 3 | read |\n \n """"""\n\n def countAccess(count):\n \n """"""\n Each time the user accesses the database we keep track of the number of times he\n connected. Whenever the user passes a reasonable number he should be rejected\n since he could be an attacker scraping your table contents and stealing company information\n You could a CRON job in your mysql system in order to clean the Aggregate column within certain timeframes\n """"""\n \n setLog(session['id'], ""User access database "", ""SUCCESS"", datetime.utcnow(), ""NULL"")\n registered_user = User.query.filter_by(id=session['id']).first()\n \n //We add the count to control variable for the update\n control = registered_user.AggregateControl + count\n \n //Check the aggregate\n if control > 5000:\n setLog(session['id'], ""Aggregate control breach"", ""FAIL"", date(""dmy""), ""HIGH"")\n \n """"""\n Then we lock out the users account assuming it has been compromised by\n an attacker\n """"""\n \n access = ""Fail""\n registered_user.status = access\n \n //we update the users table and count +1 tot the AggregateControl column\n registered_user.AggregateControl = control\n\n db.session.commit()"
Give me some sample code of Absolute timeout of a session in flask ?,"Absolute time out of a session\n\n\n Example:\n \n \n """"""\n Whenever a session is started, absolute time out (lifetime) of a session should be set in seconds\n """"""\n\n from flask import Flask, session\n\n //Initialize the flask application\n app = Flask(__name__)\n\n //Set the secret key. keep this really secret:\n app.secret_key = open(""/dev/random"",""rb"").read(32) \n\n Name of the session cookie\n app.config['SESSION_COOKIE_NAME'] = 'hrj'\n\n Path for the session cookie\n app.config['SESSION_COOKIE_PATH'] = '/'\n \n //Domain for the session cookie\n //Configure domains, do not use .yourdomain.com (wildcard)\n //This increases the attack surface!\n app.config['SESSION_COOKIE_DOMAIN'] = 'demo.yourdomain.com'\n \n //Controls if the cookie should be set with the secure flag\n app.config['SESSION_COOKIE_SECURE'] = True\n \n //Controls if the cookie should be set with the httponly flag\n app.config['SESSION_COOKIE_HTTPONLY'] = True\n \n //Lifetime of a permanent session\n app.config['PERMANENT_SESSION_LIFETIME'] = 3600\n\n //Store Value in session\n session['type'] = ""value""\n"
Give me some sample code of Sandboxing in flask ?,"Sandboxing\n\n\n Example:\n\n\n <iframe sandbox=""value"">\n /*\n sandbox="""" Applies all restrictions\n allowforms Reenables form submission\n allowpointerlock Reenables APIs\n allowpopups Reenables popups\n allowsameorigin Allows the iframe content to be treated as being from the same origin\n allowscripts Reenables scripts\n allowtopnavigation Allows the iframe content to navigate its toplevel browsing context\n */\n </iframe>\n\n"
Give me some sample code of Identifier based authorization in flask ?,"Identifierbased authorization\n\n\n Example:\n\n\n """"""\n Define the whitelist pattern and validation type and input parameter like:\n identity(""page1,page2"", ""alphanumeric"", page)\n """"""\n\n def identity(whiteListPattern, validationType, inputParameter):\n\n  continue = True\n\n  """"""\n  First, we want to filter the filenames for expected values. For this example we use only az/09\n  Whenever the values are tampered with, we can assume an attacker is trying to inject malicious input.\n  for more information about validation see ""input validations"" in the code examples:\n  """"""\n\n  if inputValidation(inputParameter, validationType, ""Invalid userinput"", ""HIGH"", countLevel) == False:\n continue = False\n\n  """"""\n  Second, we want to whitelist the filenames for expected values, in this example they are,\n  page1,page2 etc.. for more information about whitelisting see ""whitelisting"" in the code examples:\n  """"""\n\n  if whitelisting(whiteListPattern, inputParameter) == False:\n continue = False\n\n  """"""\n  Whenever you are checking whether a user is restricted to review certain data,\n  the access restrictions should be processed server side.\n  The userID could be stored inside a session variable on login, and should be used to\n  retrieve user data from the database:\n  """"""\n  \n if continue == True : \n\n  """"""\n  We count the number of connections towards the database,\n  See ""aggregate user controls"" code example for more information:\n  """"""\n\n countAccess(1)\n data = Table.query.filter_by(id=session['id'], page=inputParameter).first()\n\n return data\n\n else:\n\n return False"
Give me some sample code of Charsets in flask ?,"Charsets\n\n\n Example:\n\n\n """"""\n In order to set the ""Charsets"" header you'll have to add the following code to the head of your application, the following code could be used in your controller: For Example, text/html\n """"""\n\n //You add directly into the HTML markup\n <meta httpequiv=""ContentType"" content=""text/html; charset=utf8"">\n\n @app.after_request\n def content_Type_Charset(response):\n response.headers[""ContentType""] = ""text/html; charset=utf8""\n return response\n"
Give me some sample code of Content type headers in flask ?,"Content type headers\n\n\n Example:\n\n\n //Content Type Header for HTML pages\n response.headers[""ContentType""] = ""text/html; charset=UTF8""\n return response\n\n //Content Type Header for JSON objects\n response.headers[""ContentType""] = ""application/json""\n return response \n"
Give me some sample code of XML Injection Prevention in flask ?,"XML Injection Prevention\n\n\n Example:\n\n\n """"""\n Whenever you are using XML parsers you must sanitize or encode al userinput before\n including this input into your XML file.\n\n Some methods like below, the Dom document already encodes the input before storing it\n into the XML. But beware, since this encoded input is still a threat whenever you are\n displaying the this data on screen as HTML Output. This encoded data should be escaped\n at all times before displaying.\n\n Whenever your XML function does not encode your data on the fly, you may want to write\n your own function for achieving this. See the code examples and search for ""Input encoding""\n for more detailed information.\n """"""\n\n\n //Let us take an easy example where we store your favorite number name into a XML file.\n from lxml import etree\n\n //Create Root Element employees\n\n root = etree.Element(""employees"")\n \n //Create child Element for employees\n employee = etree.SubElement(root, ""employee"")\n name = etree.SubElement(employee, ""name"")\n \n //Insert the text in name tag\n name.text = request.form['name']\n\n //Save it in xml file\n with open(""test.xml"", ""w"") as f:\n f.write(etree.tostring(root, pretty_print=True))\n\n """"""\n We will try to insert <script>alert(123);</script> into the XML file,\n Now after inserting the employee name into the XML file it will look like:\n\n <?xml version=""1.0""?>\n <employees>\n <employee>\n <name><script>alert(123);</script></name>\n </employee>\n </employees>\n\n As you can see de input has been encoded but still can trigger an XSS whenever we\n extract the data as shown in the example below:\n\n NOTE: if you ever want to include the xml files by means of userselected sources,\n be aware of the fact that an attacker could also include sources from external websites\n and even execute External entity injections on your applications. See the ""XSLT injection prevention""\n code example for more detailed information on how to implement this type of functionality since\n the same principle's apply to both functions.\n """"""\n \n //Read from a XML file\n x = etree.parse(""test.xml"")\n\n\n for element in x.iter(""name""):\n  //This example is vulnerable to XSS\n  print element.text\n\n  //This example is escaped\n  print escape(element.text)\n\n """"""\n We recommend to not rely solely on the encoding of the input by the Dom document.\n So before you insert userinput into the XML file you want to have it sanitized.\n See the ""Encoding"" and ""input validation"" code examples for more detailed information\n """"""\n\n \n"
Give me some sample code of File upload in flask ?,"File upload\n\n\n Example:\n\n \n import os\n from flask import render_template, flash\n from flask import Flask, render_template,request, redirect\n from flask import url_for,send_from_directory\n from werkzeug.utils import secure_filename\n\n """"""\n Always store the uploaded files in a directory somewhere outside the document root or that is not \n accessible from the web. Because there is chance that attacker could upload malicious file and \n later access it via the web server. \n """"""\n \n //Path to the upload directory\n app.config['UPLOAD_FOLDER'] = '~/uploads/'\n \n //Extensions which are accepted to be uploaded\n app.config['ALLOWED_EXTENSIONS'] = set(['png', 'jpg', 'jpeg', 'pdf'])\n \n //Check whether the file can be uploaded\n def allowed_file(filename):\n  return '.' in filename and \\n  filename.rsplit('.', 1)[1].lower() in app.config['ALLOWED_EXTENSIONS']\n\n //File upload route\n @app.route('/upload', methods=['POST'])\n def upload_file():\n setLog(0, ""Upload function has started"", ""SUCCESS"", str(datetime.utcnow()), ""HIGH"")\n\n  //Check if the post request has the file part\n  if 'file' not in request.files:\n  flash('No file part')\n  return redirect(request.url)\n  \n  //Get the name of the uploaded file\n  file = request.files['file']\n\n  //Submit a empty part without filename\n  if file.filename == '':\n  flash('No selected file')\n  setLog(0, ""No File was selected"", ""FAIL"", str(datetime.utcnow()), ""HIGH"")\n  return redirect(request.url)\n  \n  //Check if the file is one of the allowed types/extensions\n  if file and allowed_file(file.filename):\n  \n  //Make the filename safe, remove unsupported chars\n  filename = secure_filename(file.filename)\n \n  //Remove the input when filename contains more than single dot\n  if len(filename.split('.')) > 1:\n   return redirect(request.url)\n\n  //Move the file form the temporal folder to the upload folder we setup\n  file.save(os.path.join(app.config['UPLOAD_FOLDER'], filename))\n\n  //Redirect the user to the uploaded_file route, which will basically show on the browser the uploaded file\n  setLog(0, ""Upload was successful"", ""SUCCESS"", str(datetime.utcnow()), ""HIGH"")\n  return redirect(url_for('uploaded_file', filename=filename))\n  \n  else:\n  flash('Not allowed extensions') \n  //Log the unsuccessful upload\n  setLog(0, ""Upload was not successful, not allowed extensions"", ""FAIL"", str(datetime.utcnow()), ""HIGH"")\n  return redirect(request.url)\n\n @app.route('/uploads/<filename>')\n def uploaded_file(filename):\n  return send_from_directory(app.config['UPLOAD_FOLDER'], filename)\n \n"
Give me some sample code of Privilege based authentication in flask ?,"Privilege based authentication\n\n\n Example:\n\n \n """"""\n For privilege based authentication we need an extra table in your database in order to write the users privileges to.\n\n TABLE users\n \n | userID | userName | password | privilegeID | access | AggregateControl  |\n \n | 1  | Admin  | Csdar323 |  1  |  TRUE | 2336  |\n  \n | 2  | User  | Adf4fsv |  2  |  FALSE | 0    |\n \n | 3  | Guest  | dff4fKr |  3  |  TRUE | 135    |\n \n\n TABLE privileges\n \n | privilegeID | privilege  |\n \n | 1  | edit:read:delete |\n \n |  2  | edit:read  |\n \n |  3  | read  |\n \n\n Now instead of using roles in sessions we rather want to assign privileges to users\n by means of a DatabaseBased Authentication system.\n Now we can easily assign a user certain privileges for him to access.\n\n Here is the isAuthorized function in which we check whether the user is permitted to do the action\n """"""\n\n def isAuthorized(ispermitted):\n\n //Select Privilege from the database\n data = Users.query.join(privileges, Users.projectID==privileges.projectID).filter_by(Users.userId==session['id'], privileges.access='TRUE').all()\n\n privilege = data.privilege\n\n //We first explode the value's to see how much parts the arrays consists of\n permission = privilege.split(':')\n authorization = ispermitted.split(':')\n\n //Then we count the authorization array\n count = len(authorization)\n counthits = 0\n\n """"""\n We check the permissions against the ispermitted value to see how many times\n they match. whenever they match we count the hits\n """"""\n\n for value in permission:\n if value == ispermitted:\n counthits = countshits + 1\n\n """"""\n Whenever the counts hits are greater or equal to the needed permissions\n we now know we deserved access to the part of the system.\n """"""\n\n if counthits > count:\n //Log that the user had sufficient privileges:\n setLog(session['id'], ""User was privileged!"", ""SUCCESS"", str(datetime.utcnow()), privilege, ""NULL"")\n return True\n else:\n //Log that the user had sufficient privileges:\n setLog(session['id'], ""User was not privileged!"", ""FAIL"", str(datetime.utcnow()), privilege, ""HIGH"")\n\n """"""\n Set counter; if counter hits 3, the user's session must be terminated.\n After 3 session terminations the user's account must be blocked.\n Given the high threat level, there will be immediate session termination.\n in this case the user tried to manipulate the application operation in order to do things he is not\n privileged to, immediate session termination will follow!\n """"""\n\n Counter.increment(3)\n return False\n"
Give me some sample code of HTML Output in flask ?,"HTML Output\n\n\n Example:\n\n\n """"""\n Whenever user input is displayed in the application, whether, as content or a parameter value\n submitted towards the url, all user input should be properly escaped to prevent XSS injections.\n """"""\n\n For normal output this escaping will do the trick\n from flask import escape\n @app.route('/', methods=['GET', 'POST'])\n def index():\n return escape(request.form['name'])\n\n This also applies, for instance, when retrieving content from a database:\n @app.route('/')\n admin = User.query.filter_by(username='admin').first()\n return escape(admin.email)\n \n For removing dangerous characters : \n\n wordDict = {'&': '&', '<' : '<', '>' : '>' , '""' : '""', ""'"" : '&x27;', '/' : &x2F;, '\' : '\\'}\n\n for key in wordDict:\n input = input.replace(key, wordDict[key])\n\n For UNTRUSTED DATA in <a href=""/site/search?value=UNTRUSTED DATA"">clickme</a>\n URL Encoding for defense\n\n import urllib\n input = urllib.quote_plus(input)\n\n """"""\n Security consists of different layers of protection, in order to guarantee the integrity\n of your application. This means that the value submitted from the user should\n already be sanitized before being submitted towards the database in order to prevent XSS.\n As an example, you are expecting only alphanumerical value here:\n """"""\n match = re.findall(""^[azAZ09]+$"", value)\n if match:\n return True\n else:\n raise Exception(""User supplied value not in the range "" + range)\n\n """"""\n This type of approach should be used whenever you are allowing userinput in\n your DOM like for example, let's say a user was allowed to upload an image and\n set an alt text. when you do not sanitize his input a possible attack string could be:\n """"""\n \n this is an image"" onload=""alert('XSS');""\n\n """"""\n whenever this string now is added to the users image this will be the outcome, leading\n to xss:\n """"""\n\n <img src=""http://image.com/image.jpg"" alt=""this is an image"" onload=""alert('XSS')"""" />\n\n """"""\n After this sanitation malicious code can no longer exist in the $_POST['value'] variable.\n\n Another possibility for attackers to execute an XSS injection, is to pass malicious code directly\n into the URL by means of a ""href"", e.g.:\n javascript:alert(document.cookie);\n or\n data:text/html;base64,base64xssinjection\n\n In the following scenario escaping with htmlspecialchars() is not sufficient to block the injection.\n By checking the URL to see if it starts with either http:// or https:// whenever a link has\n been submitted to the web application by a user.\n\n def before_request(url):\n if url.startswith('http://') or url.startswith('https://'):\n return True\n else:\n raise Exception(""Not a valid URL : "" + url)\n\n \n\n \n"
Give me some sample code of X XSS Protection Header in django ?,"XXSSProtection header\n\n\n Example:\n\n \n """"""\n In order to set the XXSSProtection header, you'll have to add the following code to the head of your application\n\n For adding XXSS Protection in every page we have to add a middleware\n Make a middleware in yourapp/middleware.py\n """"""\n\n class MyMiddleware:\n\n  def __init__(self, get_response):\n  self.get_response = get_response\n\n  def __call__(self, request):\n  response = self.get_response(request)\n  response['XXSSProtection'] = ""1; mode=block""\n  return response\n  \n  //For adding middleware in the project, add in yourproject/settings.py\n  MIDDLEWARE = [\n  ...,\n  'yourapp.middleware.MyMiddleware',\n  ...,\n ] \n\n //For adding in the individual response page using render_to_response\n response = render_to_response(""template.html"", {})\n response['XXSSProtection'] = '1; mode=block'\n\n return response\n\n //For adding in the individual response page using render\n response = render(request, ""template.html"", {})\n response['XXSSProtection'] = '1; mode=block'\n\n return response"
Give me some sample code of Enforce secure passwords in django ?,"Enforce secure passwords\n\n\n Example:\n\n \n def checkPassword(pwd):\n  error = []\n  proceed = True\n\n  //Recommended a longer password for Security\n  if(len(pwd) < 13):\n  error.append(""Password is too Short!!"")\n  proceed = False\n \n """"""\n The password should include at least one number, a small letter, a CAPS,\n and a special character as defined in the patterns array:\n """"""\n \n  if not any(x.isupper() for x in pwd):\n  error.append('Your password needs at least 1 capital letter')\n  if not any(x.islower() for x in pwd):\n  error.append('Your password needs at least 1 small letter')\n  if not any(x.isdigit() for x in pwd):\n  error.append('Your password needs at least 1 digit')\n\n """"""\n Even though your password is sufficient according to all your standards, the password could still be weak.\n Just imagine the password ""Password!""; this could easily be guessed by an attacker. To prevent the use of weak passwords we \n compare the password with a list of top 500 bad passwords and if matched, the password wil be rejected:\n """"""\n\n  file = open('badpasswords.txt').read()\n  pattern = file.split("","") \n\n  for value in pattern:\n  if value != pwd:\n  pass\n  else:\n  error.append(""Your password was matched with the bad password list, please try again."")\n  proceed = False\n  break\n  if proceed == True:\n  flash(""Your password is allowed!"")\n  return True\n else:\n  flash(""Password validation failure(your choice is weak):"")\n  for x in error:\n  print x\n  return False"
Give me some sample code of Re authentication in django ?,"Reauthentication\n\n\n Example:\n\n\n """"""\n Whenever a user wants to change his credentials or do other important data exchanges such as\n transferring money he should always be challenged to reauthenticate himself before\n allowing them to perform these actions.\n """"""\n \n from django.contrib.auth import authenticate, login\n\n def reauthenticate(request, password):\n //Access current_user\n current_user = request.user\n username = current_user.username\n //Authenticate user\n user = authenticate(request, username=username, password=password)\n //Validation of password \n if user is not None:\n //After successful validation we will log that password was validated successfully\n log.info('Successful reauthentication user : {user} via ip: {ip}'.format(\n user=user,\n ip=ip\n ))\n\n //Flush Session token \n request.session.flush()\n //Make the current_user active\n current_user.is_active = 1\n //Save the session ID \n login(request, user)\n //Success page \n return render(request, 'polls/home.html')\n else:\n //The user failed reauthenticating himself\n log.warning('Reauthentication Failed!! user : {user} via ip: {ip}'.format(\n user=user,\n ip=ip\n ))\n //If authentication failed destroyed the session\n request.session.flush()\n return render(request, 'polls/login.html')\n\n """"""\n Before we let a user perform certain actions he should first be challenged to authenticate\n himself. imagine the following scenario, the user wants to change his email address.\n """"""\n\n //Usage Example\n reauthenticate(password)"
Give me some sample code of XSL injection prevention in django ?,"XSL injection prevention\n\n\n\n Example:\n\n\n """"""\n In order to prevent XSL injections you must enforce strict policy's whenever the\n files are loaded from a source controlled by an possible attacker.\n\n Let's say for example that the user can choose from several XSL files on your application.\n\n ABC.xsl arranges your employee names on alphabetical order\n CBA.xsl does not care and just shows the input by order of your XML file.\n\n Before we want to attach the XSL files to the style sheet we first want to\n do validation on the request to make sure the included file was one of our own pre\n defined files, example:\n including(""file1.xsl,file2.xsl,etc"", 'filename' , $_GET['xslfile'])\n """"""\n\n def including(whiteListing, validation ,input, count):\n\n continue = True\n\n """"""\n First, we want to filter the filenames for expected values. For this example we use only az/09 and .\n Whenever the values are tampered with, we can assume an attacker is trying to inject malicious input.\n for more information about validation see ""input validations"" in the code examples:\n """"""\n\n if inputValidation(inputParameter, validationType, ""Invalid userinput"", ""HIGH"") == False:\n continue = False\n\n """"""\n We want to whitelist the paged for expected values, in this example they are,\n page1,page2 etc.. for more information about whitelisting see ""whitelisting"" in the code examples:\n """"""\n\n if whitelisting(whiteListing, input, count) == False:\n continue = False\n\n //If all went good we do the function\n if continue == True:\n //Load XML file\n root = etree.parse(""test.xml"")\n\n xslt_root = etree.XML(input)\n transform = etree.XSLT(xslt_root)\n\n //Transform the XML\n result_tree = transform(root)\n else: \n return False"
Give me some sample code of Session cookies (domain) in django ?,"Session cookies (domain)\n\n\n Example:\n\n\n """"""\n Whenever a session is started, and you want to share it over different domains,\n the domain value should be set to the specific domain\n\n For using sessions edit the middleware and make sure it contains 'django.contrib.sessions.middleware.SessionMiddleware'\n\n For adding HTTPONLY Cookies, we have to add the line in settings.py\n SESSION_COOKIE_HTTPONLY = True\n\n For adding Session Cookie age, we have to add the line in settings.py\n SESSION_COOKIE_AGE = 60000\n\n For setting session cookie domain, we have to add the line in settings.py\n SESSION_COOKIE_DOMAIN = 'demo.yourdomain.com'\n\n For setting session cookie name, we have to add the line in settings.py\n SESSION_COOKIE_NAME = 'demo' \n \n For setting session cookie path, we have to add the line in settings.py\n SESSION_COOKIE_PATH = '/'\n\n For setting session cookie path, we have to add the line in settings.py\n SESSION_COOKIE_SECURE = True\n """"""\n\n //For adding session cookie\n request.session['test'] = 'test'"
